{
  "$schema": "http://json-schema.org/draft-07/schema#",
  "$id": "https://project-factory.local/schemas/visual.schema.json",
  "title": "Visual task contract",
  "type": "object",
  "additionalProperties": false,
  "required": ["schemaVersion", "id", "provenance", "environment", "viewports", "scenarios", "thresholds", "accessibility", "fixtures"],
  "properties": {
    "schemaVersion": { "const": 1 },
    "id": { "$ref": "#/definitions/id" },
    "allowedResourceOrigins": { "type": "array", "uniqueItems": true, "items": { "type": "string", "pattern": "^https?://[^/]+$" } },
    "provenance": {
      "type": "object", "additionalProperties": false,
      "required": ["source", "revision", "owner"],
      "properties": { "source": { "$ref": "#/definitions/nonempty" }, "revision": { "$ref": "#/definitions/nonempty" }, "owner": { "$ref": "#/definitions/nonempty" } }
    },
    "environment": {
      "type": "object", "additionalProperties": false,
      "required": ["locale", "timezoneId", "colorScheme", "deviceScaleFactor", "fixedTime"],
      "properties": {
        "locale": { "$ref": "#/definitions/nonempty" }, "timezoneId": { "$ref": "#/definitions/nonempty" },
        "colorScheme": { "enum": ["light", "dark"] }, "deviceScaleFactor": { "type": "number", "minimum": 1, "maximum": 4 },
        "fixedTime": { "type": "string", "pattern": "^\\d{4}-\\d{2}-\\d{2}T\\d{2}:\\d{2}:\\d{2}(\\.\\d{3})?Z$" }
      }
    },
    "viewports": {
      "type": "array", "minItems": 1,
      "items": { "type": "object", "additionalProperties": false, "required": ["id", "width", "height"], "properties": { "id": { "$ref": "#/definitions/id" }, "width": { "type": "integer", "minimum": 240, "maximum": 7680 }, "height": { "type": "integer", "minimum": 240, "maximum": 7680 } } }
    },
    "scenarios": {
      "type": "array", "minItems": 1,
      "items": {
        "type": "object", "additionalProperties": false,
        "required": ["id", "path", "readySelector", "steps", "assertions", "landmarks", "masks", "screenshot", "allowHorizontalOverflow"],
        "properties": {
          "id": { "$ref": "#/definitions/id" }, "path": { "type": "string", "pattern": "^/(?!/)" }, "readySelector": { "$ref": "#/definitions/nonempty" },
          "steps": { "type": "array", "items": { "$ref": "#/definitions/step" } },
          "assertions": { "type": "array", "minItems": 1, "items": { "$ref": "#/definitions/assertion" } },
          "landmarks": { "type": "array", "minItems": 1, "items": { "$ref": "#/definitions/landmark" } },
          "masks": { "type": "array", "items": { "type": "object", "additionalProperties": false, "required": ["selector", "reason"], "properties": { "selector": { "$ref": "#/definitions/nonempty" }, "reason": { "$ref": "#/definitions/nonempty" } } } },
          "screenshot": { "oneOf": [ { "type": "object", "additionalProperties": false, "required": ["fullPage"], "properties": { "fullPage": { "type": "boolean" } } }, { "type": "object", "additionalProperties": false, "required": ["selector"], "properties": { "selector": { "$ref": "#/definitions/nonempty" } } } ] },
          "allowHorizontalOverflow": { "type": "boolean" }
        }
      }
    },
    "thresholds": {
      "type": "object", "additionalProperties": false, "required": ["pixelThreshold", "maxDiffPixelRatio", "geometryPx"],
      "properties": { "pixelThreshold": { "type": "number", "minimum": 0, "maximum": 1 }, "maxDiffPixelRatio": { "type": "number", "minimum": 0, "maximum": 1 }, "geometryPx": { "type": "number", "minimum": 0, "maximum": 100 } }
    },
    "accessibility": {
      "type": "object", "additionalProperties": false, "required": ["enabled", "tags", "maxViolations"],
      "properties": { "enabled": { "type": "boolean" }, "tags": { "type": "array", "minItems": 1, "uniqueItems": true, "items": { "enum": ["wcag2a", "wcag2aa", "wcag21a", "wcag21aa", "wcag22aa", "best-practice"] } }, "maxViolations": { "type": "integer", "minimum": 0, "maximum": 1000 } }
    },
    "fixtures": { "type": "array", "items": { "type": "object", "additionalProperties": false, "required": ["urlPattern", "status", "contentType", "body"], "properties": { "urlPattern": { "$ref": "#/definitions/nonempty" }, "status": { "type": "integer", "minimum": 200, "maximum": 599 }, "contentType": { "$ref": "#/definitions/nonempty" }, "body": { "type": "string" } } } }
  },
  "definitions": {
    "id": { "type": "string", "pattern": "^[a-z][a-z0-9-]{0,63}$" },
    "nonempty": { "type": "string", "minLength": 1, "pattern": "\\S" },
    "step": { "oneOf": [
      { "type": "object", "additionalProperties": false, "required": ["action", "selector"], "properties": { "action": { "enum": ["click", "hover", "focus"] }, "selector": { "$ref": "#/definitions/nonempty" } } },
      { "type": "object", "additionalProperties": false, "required": ["action", "selector", "value"], "properties": { "action": { "enum": ["fill", "press", "select"] }, "selector": { "$ref": "#/definitions/nonempty" }, "value": { "type": "string" } } }
    ] },
    "assertion": { "oneOf": [
      { "type": "object", "additionalProperties": false, "required": ["kind", "selector"], "properties": { "kind": { "enum": ["visible", "hidden", "focused", "checked"] }, "selector": { "$ref": "#/definitions/nonempty" } } },
      { "type": "object", "additionalProperties": false, "required": ["kind", "selector", "value"], "properties": { "kind": { "enum": ["text", "value"] }, "selector": { "$ref": "#/definitions/nonempty" }, "value": { "type": "string" } } },
      { "type": "object", "additionalProperties": false, "required": ["kind", "selector", "name", "value"], "properties": { "kind": { "const": "attribute" }, "selector": { "$ref": "#/definitions/nonempty" }, "name": { "$ref": "#/definitions/nonempty" }, "value": { "type": "string" } } }
    ] },
    "landmark": {
      "type": "object", "additionalProperties": false, "required": ["id", "selector"],
      "properties": {
        "id": { "$ref": "#/definitions/id" }, "selector": { "$ref": "#/definitions/nonempty" },
        "expected": { "type": "object", "additionalProperties": false, "required": ["x", "y", "width", "height", "text"], "properties": { "x": { "type": "number" }, "y": { "type": "number" }, "width": { "type": "number", "minimum": 0 }, "height": { "type": "number", "minimum": 0 }, "text": { "type": "string" } } },
        "expectedByViewport": { "type": "object", "additionalProperties": { "$ref": "#/definitions/landmark/properties/expected" } }
      }
    }
  }
}
